Rank,Venue Name,City,Region,Status,Recommended Path,Acquisition Fit (1-5),Management Partnership Fit (1-5),Overall Opportunity Score (1-5),Outreach Priority,Data Confidence,Key Distress Signal,Outreach Angle
1,The Cotton Room,Durham,Triangle,Open (Reputation Damaged),Partner,1,5,5,High,High,"Refund dispute went national (WRAL / Fox News); Google rating crashed to 2.9; hostile owner response; venue still fully operational","Your core product is strong — we specialize in reputation recovery and operations management. You keep ownership; we restore your rating and run day-to-day."
1,Champagne Manor,Monroe,Charlotte Metro,Closed (Foreclosed — Owner Arrested),Acquire,5,1,5,High,High,"Owner arrested Jan 2025 on $4.6M fraud charges; property in court proceedings; COVID bridge loan failure + active investor scheme","Approach lender/trustee only — do NOT contact owner. We are hospitality real estate investors — we would like to discuss a clean acquisition offer on the foreclosed property."
3,Hidden River Events,Swannanoa,Asheville / Western NC,Open (Distressed — Reopening April 2026),Partner,1,4,4,High,Medium,"Hurricane Helene (Sept 2024) caused catastrophic flood damage; venue closed ~18 months; near-zero revenue; owner transparent but financially strained","You have operated 18 years and survived what most venues never face. As you reopen in April 2026, we handle bookings and revenue pipeline — you focus on the experience."
4,Oxbow Estate,Clayton,Triangle,Closed (March 2025),Monitor,3,2,3,Medium,Medium,"Undisclosed fire code limit (40 persons inside); residential construction on adjacent land; mass cancellations forced voluntary closure","We work with venues navigating fire code and construction disruption. If you are open to discussing the property's future — sale or restructured operation — we would welcome a conversation."
4,The Valora Oak Estate (fka Farm Champion Estate),Durham,Triangle,Active (Rebranded Post-Bankruptcy),Monitor,2,3,3,Medium,Medium,"The Farm LLC filed Chapter 11 Jan 2024; operator was a tenant; rebranded under Realty Rhythm LLC; property owner may need stable long-term operator","The estate recently cycled through an operator transition after Chapter 11. If the current management arrangement is still evolving, we would be interested in a long-term partnership conversation with the property owner."
6,Lilymont Farm,Efland,Triangle / Piedmont,Unclear (Reportedly Closed 2023-2024),Insufficient Data,1,1,1,Low,Low,"No public complaint data; unclear operational status; website active but reportedly closed","Verify entity status (NC SoS + Alamance County Register of Deeds + social media last post) before any outreach. Cold contact only if verified still active."
